71,US,B2,US 12226399 B2,187-819-716-849-841,2025-02-18,2025,US 202217826289 A,2022-05-27,US 202217826289 A;;US 202163194276 P,2021-05-28,Oral aqueous suspension formulation comprising carbamate compound,"The present disclosure relates to an aqueous formulation comprising as an active ingredient a carbamate compound of Formula 1, or a pharmaceutically acceptable salt, solvate or hydrate thereof, poloxamer, and an aqueous carrier, wherein the aqueous formulation is in the form of a suspension formulation.",SK BIOPHARMACEUTICALS CO LTD,PENDSE PRAVADA;;BOMMANA MURALI M;;NOH REGINA H;;PEGAN AUGUSTIN;;WEBB TRAVIS JOHN;;MAXWELL JEJUAN,SK BIOPHARMACEUTICALS CO. LTD (2022-08-03),https://lens.org/187-819-716-849-841,Granted Patent,yes,5,0,15,111-109-197-313-573;;042-997-463-397-886;;105-565-454-473-183;;172-668-392-503-27X;;187-819-716-849-841;;123-252-227-422-840;;138-488-033-596-813;;180-817-471-897-998;;181-506-206-725-878;;091-318-187-324-348;;010-971-791-330-780;;153-444-631-916-345;;174-159-569-741-677;;151-542-428-514-670;;141-237-207-332-458,CA;;JP;;KR;;CN;;CL;;TW;;AU;;BR;;WO;;MX;;US;;AR;;EP;;IL,15,111-109-197-313-573;;042-997-463-397-886;;105-565-454-473-183;;172-668-392-503-27X;;187-819-716-849-841;;123-252-227-422-840;;138-488-033-596-813;;180-817-471-897-998;;181-506-206-725-878;;091-318-187-324-348;;010-971-791-330-780;;153-444-631-916-345;;174-159-569-741-677;;151-542-428-514-670;;141-237-207-332-458,CA;;JP;;KR;;CN;;CL;;TW;;AU;;BR;;WO;;MX;;US;;AR;;EP;;IL,0,A61K47/10;;A61K9/10;;A61K47/02;;A61K31/41;;A61K47/36;;A61P25/00;;A61K47/38;;A61K9/0095;;A61K31/41;;A61K9/0095;;A61K9/10;;A61K47/02;;A61K47/10;;A61K47/32;;A61K47/36;;A61K47/38;;A61P25/00;;A61K9/0095;;A61K47/34;;A61K47/02;;A61K47/38;;A61K47/32;;A61K31/41;;A61P25/00;;A61K9/10;;A61K31/41;;A61K47/02;;A61K47/10;;A61K47/32;;A61K47/38,A61K31/41;;A61K9/10;;A61K47/02;;A61K47/10;;A61K47/32;;A61K47/34;;A61K47/36;;A61K47/38;;A61P25/00,,0,0,,,,ACTIVE
72,US,B2,US 9290464 B2,054-286-540-912-656,2016-03-22,2016,US 201414337628 A,2014-07-22,US 201414337628 A;;KR 20100041436 A;;US 201213695809 A;;KR 2011003318 W,2010-05-03,Pharmaceutical composition for inhibiting apoptosis of neuron or neurodegeneration,Provided is a pharmaceutical composition for inhibiting apoptosis of neurons or neurodegeneration. The pharmaceutical composition effectively prevents or treats diseases related to apoptosis of neurons or neurodegeneration.,SK BIOPHARMACEUTICALS CO LTD,PARK CHEOL HYOUNG;;MIN HYE KYUNG;;PARK IN SUK;;LIM MI JUNG;;LEE JI WON;;CHUNG JIN YONG;;YOON YEO JIN;;PARK JOO YOUNG,,https://lens.org/054-286-540-912-656,Granted Patent,yes,15,0,29,083-039-858-242-705;;112-978-299-565-262;;167-510-528-540-117;;030-396-572-256-67X;;005-606-654-973-855;;044-160-932-409-906;;179-167-967-243-034;;105-588-674-891-784;;083-927-741-654-410;;181-093-802-766-315;;115-475-254-140-257;;033-176-141-122-359;;001-137-200-928-772;;100-201-254-946-24X;;128-594-256-312-773;;034-852-710-631-338;;173-997-219-171-383;;030-774-362-450-39X;;077-722-933-911-999;;013-924-370-730-345;;191-530-673-964-029;;163-910-907-096-308;;013-649-920-355-110;;135-196-887-792-996;;054-286-540-912-656;;103-278-855-304-829;;056-912-353-242-800;;179-903-799-833-766;;137-947-736-509-345,CA;;RU;;KR;;JP;;BR;;WO;;MX;;CN;;US;;ES;;EP;;AU,29,083-039-858-242-705;;112-978-299-565-262;;167-510-528-540-117;;030-396-572-256-67X;;005-606-654-973-855;;044-160-932-409-906;;179-167-967-243-034;;105-588-674-891-784;;083-927-741-654-410;;181-093-802-766-315;;115-475-254-140-257;;033-176-141-122-359;;001-137-200-928-772;;100-201-254-946-24X;;128-594-256-312-773;;034-852-710-631-338;;173-997-219-171-383;;030-774-362-450-39X;;077-722-933-911-999;;013-924-370-730-345;;191-530-673-964-029;;163-910-907-096-308;;013-649-920-355-110;;135-196-887-792-996;;054-286-540-912-656;;103-278-855-304-829;;056-912-353-242-800;;179-903-799-833-766;;137-947-736-509-345,CA;;RU;;KR;;JP;;BR;;WO;;MX;;CN;;US;;ES;;EP;;AU,0,C07D261/08;;A61K31/4196;;A61K31/4245;;A61K31/433;;A61P9/10;;A61P25/00;;A61P25/08;;A61P25/14;;A61P25/16;;A61P25/18;;A61P25/24;;A61P25/28;;A61P27/02;;A61P31/00;;A61P43/00;;A61K31/4196;;A61K31/4245;;A61K31/433;;A61K2121/00;;A61K31/4196;;A61K31/42;;A61K31/4245;;A61K31/433;;A61P25/00;;A61P25/28;;C07D261/08;;A61K31/4196;;A61K31/4245;;A61K31/433,A61K31/42;;A61K31/41;;A61K31/4196;;A61K31/4245;;A61K31/425;;A61K31/433;;C07D261/08,,45,41,014-940-369-418-721;;059-772-259-790-672;;003-442-169-604-000;;062-784-033-080-439;;082-752-597-106-197;;000-592-134-863-138;;044-031-150-189-426;;079-487-506-039-265;;007-184-165-866-448;;005-962-605-901-91X;;023-664-658-989-49X;;053-881-431-566-061;;031-924-029-481-368;;002-642-713-148-310;;100-925-308-977-978;;018-052-409-408-975;;095-570-487-792-864;;125-442-892-352-782;;028-585-517-362-171;;039-899-380-419-069;;001-984-489-498-626;;019-425-317-169-116;;122-079-859-330-191;;072-445-148-605-027;;087-509-537-522-158;;097-453-736-173-440;;019-121-815-747-473;;009-501-675-949-701;;004-366-945-590-823;;074-555-246-495-925;;014-531-661-219-036;;011-004-785-493-826;;022-437-410-146-855;;016-068-174-873-998;;025-601-771-249-260;;026-023-618-909-247;;062-139-337-054-262;;023-338-367-652-578;;065-356-303-160-104;;019-755-188-269-314;;077-840-643-698-250,10.1634/stemcells.2006-0223;;16990586;;10.1002/chin.200423235;;11588183;;pmc6763865;;10.1523/jneurosci.21-20-08108.2001;;12031278;;10.1016/s0361-9230(01)00775-4;;10.1006/exnr.2002.8033;;12504889;;7689641;;10.1111/j.1471-4159.1993.tb03633.x;;16787833;;10.1007/bf03033786;;10.1002/ana.20624;;16178023;;10.1016/j.jns.2009.02.008;;10.1016/0361-9230(91)90242-c;;1826461;;10.1111/j.1582-4934.2003.tb00225.x;;pmc6741335;;14594549;;14964686;;10.1080/14734220310004289;;10.1016/s0165-0173(98)00046-0;;9974149;;pmc6762498;;10.1523/jneurosci.21-10-j0001.2001;;11319241;;10.1056/nejmra022366;;12672865;;9013391;;10.1007/bf01291788;;pmc4514105;;10.1111/j.1582-4934.2008.00402.x;;18624755;;10.1101/gad.13.15.1899;;10444588;;12729576;;10.1016/s0006-291x(03)00614-4;;9157311;;10.1016/0306-4522(95)00571-4;;17468299;;10.1124/jpet.106.118034;;pmc6786015;;9952406;;10.1523/jneurosci.19-04-01284.1999;;12200198;;10.1016/s0892-0362(02)00221-0;;11253364;;10.1038/35040009;;10.1038/nrn1886;;16552414;;pmc3710114;;9875735;;10.1097/00001756-199812010-00034;;9581757;;10.1016/s0896-6273(00)81004-1;;10.1016/0306-4522(95)00066-r;;7675192;;9827592;;9613716;;10.1002/mds.870131306;;12671216;;10.1016/0306-4522(94)90605-x;;7516500;;10.1007/s10863-005-6590-8;;16167175;;pmc2570496;;9409726;;10.1016/s0006-8993(97)00941-4;;10.1016/s0892-0362(02)00222-2;;12200192;;10.1111/j.1471-4159.1993.tb13610.x;;8376979;;10.1007/s11094-006-0087-6;;10.2165/00023210-200519090-00001;;16142989;;10.1038/nrn1883;;16552415;;10.1016/s0896-6273(03)00601-9;;14556717;;10683571;;10.1016/s0306-4522(99)00567-9;;17056129;;10.1016/j.tips.2006.10.004,"Kimura et al. Stem Cells 25 (2007) 115-124.;;Gfesser, et al. (2004) ""Structure-activity relationships of non-imidazole H3 receptor ligands. Part 3: 5-Substituted 3-phenyl-1,2,4-oxadiazoles as potent antagonists."" Bioorganic & Medicinal Chemistry Letters, 14:673-676.;;Akerud, et al., ""Neuroprotection through Delivery of Glial Cell Line-Derived Neurotrophic Factor by Neural Stem Cells in a Mouse Model of Parkinson's Disease."", The Journal of Neuroscience, 21:8108-8118, 2001.;;Alberch, et al., ""Neuroprotection by neurotrophins and GDNF family members in the excitotoxic model of Huntington's Disease."" Brain Research Bulletin, 57:817-822, 2002.;;Armentero, et al. ""Dopamine Receptor Agonists Mediate Neuroprotection in Malonate-Induced Striatal Lesion in the Rat."" Experimental Neurology, 178:301-305.;;Beal, et al. ""Age-Dependent Striatal Excitotoxic Lesions Produced by the Endogenous Mitochondrial Inhibitor Malonate."" J. Neurochem. 61:1147-1150, 1993.;;Beal, et al., Neuroprotective and Neurorestorative Strategies for Neuronal Injury., Neurotoxicity Research, 2:71-84, 2000.;;Beal, ""Mitochondria Take Center Stage in Aging and Neurodegeneration."", Ann. Neurol., 58:495-505, 2005.;;Beal, ""Mitochondrial dysfunction in neurodegenerative diseases and stroke: Neuroprotective strategies."", Journal of Neurological Sciences, 283:240-320, 2009.;;Behl, et al., ""Serial Review: Causes and Consequences of Oxidative Stress in Alzheimer's Disease."" Free radical Biology & Medicine, 33(2): 182-191, 2002.;;Berger, et al., ""Retrograde Degeneration of Nitrostriatal Neurons Induced by Instrastriatal 6-Hydroxydopamine Injection in Rats."", Brain Res., 26:301-307, 1991.;;Burlacu, ""Regulation of apoptosis by Bcl-2 family proteins."" J. Cell Mol. Med., 7:249-257, 2003.;;Canu, et al, ""In vitro cultured neurons for molecular studies correlating apoptosis with events related to Alzheimer disease."", Cerebellum, 2:270-278, 2003.;;Cassarino, et al., ""An evaluation of the role of mitochondria in neurodegenerative diseases: mitochondrial mutations and oxidative pathology, protective nuclear responses, and cell death in neurodegeneration."", Brain Res Review, 29(1):1-25, 1999.;;Chen, et al., ""Neuroprotection by Caffeine and A2A Adenosine Receptor Inactivation in a model of Parkinson's Disease."", J. Neurosci., 21:RC143, 2001.;;Friedlander, ""Apoptosis and Caspases in Neurodegenerative Diseases."", The New England Journal of Medicine, 348(14):1365-1375, 2003.;;Gerlach, et al., ""Animal models of Parkinson's Disease: an empirical comparison with the phenomenology of the disease in man."", J. Neural Trasm., 103:987-1041.;;Gorman, ""Neuronal cell death in neurodegenerative diseases: recurring themes around protein handling."", Journal of Cellular and Molecular Medicine, 12:2263-2280, 2008.;;Gross, et al., ""BCL-2 family members and the mitochondria in apoptosis."" Genes and Development, 13:1899-1911, 1999.;;Kroemer, ""Mitochondrial control of apoptosis: an introduction."" Biochem Biophys Res Commun., 304(3):433-435, 2003.;;Lee, et al., ""Dopaminergic Neuronal Degeneration and Motor Impairments Following Axon Terminal Lesion by Intrastriatal 6-Hydroxydopamine in the Rat."", Neurosci., 72:641-653, 1996.;;Lin, et al., ""Neuroprotection by Small Molecule Activators of the Nerve Growth Factor Receptor."", The Journal of Pharmacology and Experimental Therapeutics, 322:59-69, 2007.;;Lotharius, et al., ""Distinct Mechanisms Underlie Neurotoxin-Mediated Cell Death in Cultured Dopaminergic Neurons."", J. Neurosci., 19:1284-1293, 1999.;;Maruyama, et al., ""Neuroprotection by propargylamines in Parkinson's disease Suppression of apoptosis and induction of prosurvival genes."", Neurotoxicology and Teratolgy, 24:675-682, 2002.;;Mattson, ""Apoptosis in Neurodegenerative Disorders."" Nature Reviews Molecular Cell Biology, 1:120-130, 2000.;;Mattson, et al., ""Ageing and neuronal vulnerability."" Nat. Rev. Neurosci., 7:278-294, 2006.;;Monopoli, et al., ""Blockade of adenosine A2A receptors by SCH 58261 results in neuroprotective effects in cerebral ischaemia in rats."", Neuro Report, 9:3955-3959, 1998.;;Nagahara, et al., ""Neuroprotective effects of brain-deprived neurotrophic factor in rodent and primate models of Alzheimer's Disease."", Narure medicine.;;Pettmann, et al., ""Neruonal Cell Death"" Neuron., 20:633-647, 1998.;;Przedborski, et al., ""Dose-Dependent Lesions of the Dopaminergic Nigrostriatal Pathway Induced by Intrastriatal Injection of 6-Hydroxydopamine."", Neurosci., 67:631-647, 1995.;;Przedborski, et al., ""Mechanisms of MPTP Toxicity."", Mov. Disord., 13:35-38, 1998.;;Przedborski, et al., ""The parkinsonian toxin MPTP: action and mechanism."" Restor. Neurol. Neurosci., 16:135-142, 2000.;;Sauer, et al., ""Progressive Degeneration of Nigrostriatal Dopamine Neurons Following Instrstriatal Terminal Lesions with 6-Hydroxydopamine: A Combined Retrograde Tracing and Immunocytochemical Study in the Rat."", Neurosci., 59:401-415, 1994.;;Soane, et al., ""Inhibition of Mitochondrial Neural Cell Death Pathways by Protein Transduction of Bcl-2 Family Proteins."", Journal of Bioenergetics and Biomembranes, 37:179-190, 2005.;;Sonsalla, et al. ""Inhibition of striatal energy metabolism produces cell loss in the ipsilateral substantia nigra."", Brain Res., 773:223-226, 1997.;;Speciale, ""MPTP Insights into parkinsonian neurodegeneration."" Neurotoxicol. Teratol. 24:607-620, 2002.;;Tipton, et al., ""Advances in Our Understanding of the Mechanisms of the Neurotoxicity of MPTP and Related Compounds."", J. Neurochem., 61:1191-1206, 1993.;;Velikorodov, et al., ""Synthesis and Cardiovascular Activity of Some Azaheterocycles with Carbamate Groups."", Pharmaceutical Chemistry Journal, vol. 40, No. 4, 182-185, 2006.;;Wu, et al., ""Treatment of Parkinson's' Disease What's on the Horizon?"", CNS Drugs, 19:723, 2005.;;Youdim, et al., ""The therapeutic potential of monoamine oxidase inhibitors."" Nat. Rev. Neurosci., 7:295-309, 2006.;;Yuan, et al., ""Diversity in the Mechanisms of Neuronal Cell Death."" Neuron, 40:401-413, 2003.;;Zeevalk, et al., ""Oxidative Stress During Energy Impairment in Mesencephalic Cultures is not a Downstream Consequence of a Secondary Excitotoxicity."", Neuroscience, 96:309-316, 2000.;;Zhang, et al., ""Neuroprotective effects of huperzine A: new therapeutic targets for neurodegenerative disease."" TRENDS in Pharmaceutical Sciences, 27:619-625, 2006.;;PCT/KR2011/003318 International Search Report dated Jan. 10, 2012 (3 pgs.).;;The extended European Search Report issued in EP 11777560.1, dated Feb. 13, 2014.",ACTIVE
73,US,B2,US 9068207 B2,034-404-087-195-992,2015-06-30,2015,US 201313776964 A,2013-02-26,US 201313776964 A;;US 90426710 A;;US 25186709 P,2009-10-15,Method for preparation of carbamic acid (R)-1-aryl-2-tetrazolyl-ethyl ester,"Disclosed is a method for the preparation of carbamic acid (R)-1-aryl-2-tetrazolyl-ethyl esters, comprising the enantioselective enzyme reduction of a 1-aryl-2-tetrazolyl-ethyl ketone to form a (R)-1-aryl-2-tetrazolyl-ethyl alcohol and the carbamation of said alcohol.",SK BIOPHARMACEUTICALS CO LTD;;SK BIOPHARMACEUTICALS CO LTD,LIM SANG CHUL;;UHM MOO YONG;;LEE DAE WON;;KIM HUI HO;;LEE DONG HO;;LEE HYUN SEOK,,https://lens.org/034-404-087-195-992,Granted Patent,yes,87,0,34,016-197-744-023-399;;038-532-396-776-768;;117-360-948-134-305;;100-961-428-414-334;;126-300-092-826-786;;010-230-015-612-963;;055-058-684-385-949;;034-404-087-195-992;;085-485-945-533-853;;193-170-982-419-952;;151-820-942-918-798;;094-952-948-890-748;;095-655-236-166-570;;118-596-803-384-538;;072-679-912-699-324;;114-195-532-650-52X;;109-515-102-992-078;;041-488-748-194-116;;069-796-278-488-670;;136-889-561-047-716;;011-196-245-292-379;;121-249-289-774-323;;105-513-255-591-588;;026-150-348-487-268;;118-470-678-781-636;;149-849-678-101-400;;171-411-424-337-617;;115-870-633-855-244;;037-806-165-788-023;;193-394-402-499-566;;155-040-750-977-927;;044-652-973-822-810;;182-096-519-644-558;;157-158-332-478-988,CA;;RU;;KR;;JP;;ZA;;HU;;CN;;PL;;CL;;MY;;ES;;AU;;BR;;WO;;MX;;US;;HK;;EP;;IL,34,016-197-744-023-399;;038-532-396-776-768;;117-360-948-134-305;;100-961-428-414-334;;126-300-092-826-786;;010-230-015-612-963;;055-058-684-385-949;;034-404-087-195-992;;085-485-945-533-853;;193-170-982-419-952;;151-820-942-918-798;;094-952-948-890-748;;095-655-236-166-570;;118-596-803-384-538;;072-679-912-699-324;;114-195-532-650-52X;;109-515-102-992-078;;041-488-748-194-116;;069-796-278-488-670;;136-889-561-047-716;;011-196-245-292-379;;121-249-289-774-323;;105-513-255-591-588;;026-150-348-487-268;;118-470-678-781-636;;149-849-678-101-400;;171-411-424-337-617;;115-870-633-855-244;;037-806-165-788-023;;193-394-402-499-566;;155-040-750-977-927;;044-652-973-822-810;;182-096-519-644-558;;157-158-332-478-988,CA;;RU;;KR;;JP;;ZA;;HU;;CN;;PL;;CL;;MY;;ES;;AU;;BR;;WO;;MX;;US;;HK;;EP;;IL,8,A61P25/00;;C07D257/04;;C07D257/06;;A61K31/41;;C12P17/12;;C12P17/10;;C07D257/04,C12P17/10;;C07D257/04,,10,4,010-680-137-385-664;;139-582-685-904-567;;001-580-232-559-357;;005-903-507-321-057,10.1016/j.tet.2007.12.020;;10.1016/j.tetasy.2008.12.035;;19251421;;10.1016/j.bmc.2009.02.004;;10.1016/s0957-4166(01)00020-9,"Hobuss et al. (2008) ""Catalytic enantioselective borane reduction of arylketones with pinene-derived amino alcohols,"" Tetrahedron, 64(8):1635-1640.;;Matsuda, T. et al. (2009) ""Recent progress in biocatalysis for asymmetric oxidation and reduction."" Tetrahedron: Asymmetry. 20(5):513-557.;;Rostom et al., (2009) ""Azole antimicrobial pharmacophore-based tetrazoles: Synthesis and biological evaluation as potential antimicrobial and anticonvulsant agents,"" Bioorganic & Medicinal Chemistry 17:2410-2422.;;Yadav et al., (2001) ""A facile synthesis of (R)-(-)-2-azido-1-arylethanols from 2-azido-1-arylketones using baker's yeast,"" Tetrahedron: Asymmetry, 12(1):63-67.;;European Search Opinion mailed Oct. 22, 2012 from the European Patent Office in the corresponding European Patent Application No. 09846577.6.;;International Search Report and Written Opinion mailed on Apr. 28, 2010 in the corresponding PCT Application No. PCT/KR2009/005906.;;International Search Report and Written Opinion mailed on Jul. 11, 2011 in the related PCT Application No. PCT/KR2010/007069.;;Office Action dated Jan. 31, 2012 issued in U.S. Appl. No. 12/578,709.;;Office Action dated May 18, 2012 issued in U.S. Appl. No. 12/904,267.;;Office Action dated Jun. 29, 2012 issued in U.S. Appl. No. 12/578,709.",ACTIVE
74,US,A1,US 2014/0350062 A1,115-475-254-140-257,2014-11-27,2014,US 201414337628 A,2014-07-22,US 201414337628 A;;KR 20100041436 A;;US 201213695809 A;;KR 2011003318 W,2010-05-03,PHARMACEUTICAL COMPOSITION FOR INHIBITING APOPTOSIS OF NEURON OR NEURODEGENERATION,Provided is a pharmaceutical composition for inhibiting apoptosis of neurons or neurodegeneration. The pharmaceutical composition effectively prevents or treats diseases related to apoptosis of neurons or neurodegeneration.,SK BIOPHARMACEUTICALS CO LTD,PARK CHEOL HYOUNG;;MIN HYE KYUNG;;PARK IN SUK;;LIM MI JUNG;;LEE JI WON;;CHUNG JIN YONG;;YOON YEO JIN;;PARK JOO YOUNG,,https://lens.org/115-475-254-140-257,Patent Application,yes,0,1,29,083-039-858-242-705;;112-978-299-565-262;;167-510-528-540-117;;030-396-572-256-67X;;005-606-654-973-855;;044-160-932-409-906;;179-167-967-243-034;;105-588-674-891-784;;083-927-741-654-410;;181-093-802-766-315;;115-475-254-140-257;;033-176-141-122-359;;001-137-200-928-772;;100-201-254-946-24X;;128-594-256-312-773;;034-852-710-631-338;;173-997-219-171-383;;030-774-362-450-39X;;077-722-933-911-999;;013-924-370-730-345;;191-530-673-964-029;;163-910-907-096-308;;013-649-920-355-110;;135-196-887-792-996;;054-286-540-912-656;;103-278-855-304-829;;056-912-353-242-800;;179-903-799-833-766;;137-947-736-509-345,CA;;RU;;KR;;JP;;BR;;WO;;MX;;CN;;US;;ES;;EP;;AU,29,083-039-858-242-705;;112-978-299-565-262;;167-510-528-540-117;;030-396-572-256-67X;;005-606-654-973-855;;044-160-932-409-906;;179-167-967-243-034;;105-588-674-891-784;;083-927-741-654-410;;181-093-802-766-315;;115-475-254-140-257;;033-176-141-122-359;;001-137-200-928-772;;100-201-254-946-24X;;128-594-256-312-773;;034-852-710-631-338;;173-997-219-171-383;;030-774-362-450-39X;;077-722-933-911-999;;013-924-370-730-345;;191-530-673-964-029;;163-910-907-096-308;;013-649-920-355-110;;135-196-887-792-996;;054-286-540-912-656;;103-278-855-304-829;;056-912-353-242-800;;179-903-799-833-766;;137-947-736-509-345,CA;;RU;;KR;;JP;;BR;;WO;;MX;;CN;;US;;ES;;EP;;AU,0,C07D261/08;;A61K31/4196;;A61K31/4245;;A61K31/433;;A61P9/10;;A61P25/00;;A61P25/08;;A61P25/14;;A61P25/16;;A61P25/18;;A61P25/24;;A61P25/28;;A61P27/02;;A61P31/00;;A61P43/00;;A61K31/4196;;A61K31/4245;;A61K31/433;;A61K2121/00;;A61K31/4196;;A61K31/42;;A61K31/4245;;A61K31/433;;A61P25/00;;A61P25/28;;C07D261/08;;A61K31/4196;;A61K31/4245;;A61K31/433,C07D261/08,514/378,1,1,014-940-369-418-721,10.1634/stemcells.2006-0223;;16990586,Kimura et al. Stem Cells 25 (2007) 115-124.,ACTIVE
75,EP,B1,EP 1879873 B1,157-657-824-512-659,2013-10-09,2013,EP 06768472 A,2006-04-21,KR 2006001523 W;;US 67453005 P,2005-04-22,NEUROTHERAPEUTIC AZOLE COMPOUNDS,,SK BIOPHARMACEUTICALS CO LTD,CHOI YONG-MOON;;KIM CHOON-GIL;;KANG YOUNG-SUN;;YI HAN-JU;;LEE HYUN-SEOK;;KU BON-CHUL;;LEE EUN-HO;;IM DAE-JOONG;;SHIN YU-JIN,"SK BIOPHARMACEUTICALS CO., LTD., KR (2018-12-14);;SK BIOPHARMACEUTICALS CO., LTD. (2012-03-14)",https://lens.org/157-657-824-512-659,Granted Patent,yes,1,0,34,016-822-368-774-981;;196-754-367-480-282;;025-132-948-117-281;;019-469-508-277-771;;157-657-824-512-659;;122-254-729-268-807;;180-232-893-065-231;;017-987-040-851-615;;000-680-957-729-597;;006-920-412-140-801;;139-527-526-424-169;;069-474-687-657-162;;083-286-225-706-598;;056-745-581-271-210;;067-295-709-373-878;;013-963-816-145-602;;194-960-877-543-401;;029-305-540-871-019;;042-360-756-119-232;;101-617-645-457-318;;018-793-095-827-904;;161-520-181-401-177;;104-338-199-379-619;;077-980-256-736-311;;000-732-844-264-860;;067-331-391-354-92X;;134-514-719-844-835;;178-238-990-495-618;;190-616-138-405-656;;142-903-062-833-312;;034-768-583-874-799;;179-653-074-541-863;;075-627-671-506-61X;;099-025-001-215-146,CA;;RU;;KR;;JP;;PT;;ZA;;CN;;NL;;PL;;ES;;MY;;TW;;AU;;DK;;BR;;FI;;MX;;WO;;US;;AR;;EP,34,016-822-368-774-981;;196-754-367-480-282;;025-132-948-117-281;;019-469-508-277-771;;157-657-824-512-659;;122-254-729-268-807;;180-232-893-065-231;;017-987-040-851-615;;000-680-957-729-597;;006-920-412-140-801;;139-527-526-424-169;;069-474-687-657-162;;083-286-225-706-598;;056-745-581-271-210;;067-295-709-373-878;;013-963-816-145-602;;194-960-877-543-401;;029-305-540-871-019;;042-360-756-119-232;;101-617-645-457-318;;018-793-095-827-904;;161-520-181-401-177;;104-338-199-379-619;;077-980-256-736-311;;000-732-844-264-860;;067-331-391-354-92X;;134-514-719-844-835;;178-238-990-495-618;;190-616-138-405-656;;142-903-062-833-312;;034-768-583-874-799;;179-653-074-541-863;;075-627-671-506-61X;;099-025-001-215-146,CA;;RU;;KR;;JP;;PT;;ZA;;CN;;NL;;PL;;ES;;MY;;TW;;AU;;DK;;BR;;FI;;MX;;WO;;US;;AR;;EP,0,C07D257/04;;A61P3/04;;A61P9/10;;A61P21/00;;A61P25/00;;A61P25/06;;A61P25/08;;A61P25/20;;A61P25/24;;A61P25/28;;A61P25/30;;A61P25/34;;A61P29/00;;C07D249/04;;C07D401/12;;C07D401/14;;C07D403/12;;C07D405/06;;C07D257/04;;A61K31/4192;;C07D257/04;;C07D249/04;;C07D401/12;;C07D401/14;;C07D403/12;;C07D405/06,C07D249/04;;C07D257/04;;C07D401/12;;C07D401/14;;C07D403/12;;C07D405/06,,1,0,,,"ARZU KARAKURT ET AL.: 'Synthesis of some 1-(2-naphthyl)-2-(imidazole-1-yl)ethanone oxime and oxime ether derivatives and their anticonvulsant and antimicrobial activities' EUR. J. MED. CHEM. vol. 36, 2001, pages 421 - 433, XP004372854",ACTIVE
76,US,A1,US 2017/0105973 A1,186-704-426-793-951,2017-04-20,2017,US 201615394481 A,2016-12-29,US 201615394481 A;;KR 20120125516 A;;US 201615231382 A;;US 201514441277 A;;KR 2013010088 W,2012-11-07,SOLID DISPERSIONS OF INSOLUBLE DRUG AND PREPARATION METHOD THEREOF,"The present invention relates to a solid dispersion characterized in that it comprises carbamic acid 3-(4-benzyloxy-phenyl)-isoxazol-5-ylmethyl ester as an active ingredient and a water-soluble polymer having a glass transition temperature lower than the melting point of the active ingredient as a carrier, and it is prepared via melt extrusion. The solid dispersion of the present invention remarkably increases the solubility and dissolution rate of the active ingredient which is an insoluble drug to efficiently improve the bioavailability when it is orally administered.",SK BIOPHARMACEUTICALS CO LTD,BAEK MYOUNG KI;;PEGAN AUGUSTIN,SK BIOPHARMACEUTICALS CO. LTD (2015-04-29),https://lens.org/186-704-426-793-951,Patent Application,yes,3,0,30,128-620-442-386-588;;028-343-319-786-633;;184-988-190-580-830;;047-396-290-600-150;;034-164-982-258-945;;084-719-226-983-455;;159-256-564-500-664;;137-858-336-936-060;;015-789-677-099-344;;034-768-311-267-012;;158-063-407-607-233;;077-346-478-004-062;;012-993-406-841-921;;144-214-810-400-133;;009-016-496-340-563;;077-664-040-242-553;;059-818-577-811-185;;142-180-585-070-83X;;171-736-899-421-471;;137-408-508-367-59X;;030-714-980-956-369;;035-123-234-357-441;;070-848-719-776-254;;109-855-883-873-055;;107-181-894-552-82X;;185-072-571-289-680;;186-704-426-793-951;;088-325-414-156-864;;096-015-093-763-44X;;123-899-487-200-838,RU;;CA;;JP;;KR;;TR;;CN;;PL;;ES;;AU;;BR;;WO;;MX;;US;;HK;;EP,30,128-620-442-386-588;;028-343-319-786-633;;184-988-190-580-830;;047-396-290-600-150;;034-164-982-258-945;;084-719-226-983-455;;159-256-564-500-664;;137-858-336-936-060;;015-789-677-099-344;;034-768-311-267-012;;158-063-407-607-233;;077-346-478-004-062;;012-993-406-841-921;;144-214-810-400-133;;009-016-496-340-563;;077-664-040-242-553;;059-818-577-811-185;;142-180-585-070-83X;;171-736-899-421-471;;137-408-508-367-59X;;030-714-980-956-369;;035-123-234-357-441;;070-848-719-776-254;;109-855-883-873-055;;107-181-894-552-82X;;185-072-571-289-680;;186-704-426-793-951;;088-325-414-156-864;;096-015-093-763-44X;;123-899-487-200-838,RU;;CA;;JP;;KR;;TR;;CN;;PL;;ES;;AU;;BR;;WO;;MX;;US;;HK;;EP,0,A61K9/146;;A61K31/42;;C07D261/08;;A61K9/2027;;C07D261/08;;A61K9/146;;A61K9/2027;;A61K47/32;;A61K31/42;;A61P25/00;;A61P25/28;;A61K47/34;;A61K47/30;;A61K31/42;;C07D261/08;;A61K9/0053;;A61K9/141;;A61K9/146;;A61K9/20;;A61K31/42;;A61K47/00;;A61K47/30;;A61K2121/00;;C07D261/08;;A61K9/146;;A61K9/2027;;B01F23/66;;B01F23/81;;B01F35/90;;B01F27/40;;B01F2035/99;;B01F2101/22;;A61K31/42;;A61K9/10;;A61K47/32;;A61K9/0053;;A61K9/2031,A61K31/42;;A61K9/00;;A61K9/20;;B01F23/80,,1,0,,,"Vitamin E TPGS NF and Food Grade, June 20012",ACTIVE
