"#",Jurisdiction,Kind,Display Key,Lens ID,Publication Date,Publication Year,Application Number,Application Date,Priority Numbers,Earliest Priority Date,Title,Abstract,Applicants,Inventors,Owners,URL,Document Type,Has Full Text,Cites Patent Count,Cited by Patent Count,Simple Family Size,Simple Family Members,Simple Family Member Jurisdictions,Extended Family Size,Extended Family Members,Extended Family Member Jurisdictions,Sequence Count,CPC Classifications,IPCR Classifications,US Classifications,NPL Citation Count,NPL Resolved Citation Count,NPL Resolved Lens ID(s),NPL Resolved External ID(s),NPL Citations,Legal Status
1,EP,A1,EP 3711758 A1,175-848-266-125-914,2020-09-23,2020,EP 18878222 A,2018-11-13,KR 20170151248 A;;KR 2018013761 W,2017-11-14,"USE OF CARBAMATE COMPOUND FOR PREVENTING, ALLEVIATING OR TREATING ABSENCE SEIZURE OR EPILEPSY SHOWING ABSENCE SEIZURE","The present invention relates to a use of a carbamate compound represented by chemical formula 1, or a pharmaceutically acceptable salt, a solvate or a hydrate thereof for preventing, alleviating or treating absence seizure or epilepsy showing absence seizure.",SK BIOPHARMACEUTICALS CO LTD,SHIN HYE WON,,https://lens.org/175-848-266-125-914,Patent Application,yes,0,0,27,095-418-251-758-452;;172-016-358-273-69X;;076-848-262-066-276;;135-481-838-122-470;;098-543-216-736-719;;086-571-364-434-926;;000-725-273-383-720;;056-496-205-069-225;;153-947-887-303-504;;058-375-562-836-105;;006-707-689-459-29X;;036-594-672-948-003;;175-848-266-125-914;;180-295-791-525-434;;030-642-208-724-01X;;099-848-387-400-56X;;015-109-212-500-52X;;026-234-878-168-692;;152-734-280-865-740;;011-181-861-380-530;;096-866-746-743-864;;043-369-112-902-472;;063-745-038-278-465;;141-748-827-420-509;;063-479-285-377-285;;080-616-656-930-540;;027-314-878-690-911,RU;;CA;;JP;;KR;;PT;;PL;;CN;;ES;;AU;;DK;;FI;;BR;;WO;;MX;;US;;IL;;EP,27,095-418-251-758-452;;172-016-358-273-69X;;076-848-262-066-276;;135-481-838-122-470;;098-543-216-736-719;;086-571-364-434-926;;000-725-273-383-720;;056-496-205-069-225;;153-947-887-303-504;;058-375-562-836-105;;006-707-689-459-29X;;036-594-672-948-003;;175-848-266-125-914;;180-295-791-525-434;;030-642-208-724-01X;;099-848-387-400-56X;;015-109-212-500-52X;;026-234-878-168-692;;152-734-280-865-740;;011-181-861-380-530;;096-866-746-743-864;;043-369-112-902-472;;063-745-038-278-465;;141-748-827-420-509;;063-479-285-377-285;;080-616-656-930-540;;027-314-878-690-911,RU;;CA;;JP;;KR;;PT;;PL;;CN;;ES;;AU;;DK;;FI;;BR;;WO;;MX;;US;;IL;;EP,0,A61K31/41;;A61P25/08;;A61K31/41;;A61K31/16;;A61P25/08;;A61K31/41;;A61K31/16;;A61P25/08;;A61K31/41,A61K31/41;;A61K31/16,,0,0,,,,ACTIVE
2,EP,B1,EP 3711758 B1,026-234-878-168-692,2024-03-27,2024,EP 18878222 A,2018-11-13,KR 20170151248 A;;KR 2018013761 W,2017-11-14,"USE OF CARBAMATE COMPOUND FOR PREVENTING, ALLEVIATING OR TREATING ABSENCE SEIZURE OR EPILEPSY SHOWING ABSENCE SEIZURE",,SK BIOPHARMACEUTICALS CO LTD,SHIN HYE WON,,https://lens.org/026-234-878-168-692,Granted Patent,yes,8,0,27,095-418-251-758-452;;172-016-358-273-69X;;076-848-262-066-276;;135-481-838-122-470;;098-543-216-736-719;;086-571-364-434-926;;000-725-273-383-720;;056-496-205-069-225;;153-947-887-303-504;;058-375-562-836-105;;006-707-689-459-29X;;036-594-672-948-003;;175-848-266-125-914;;180-295-791-525-434;;030-642-208-724-01X;;099-848-387-400-56X;;015-109-212-500-52X;;026-234-878-168-692;;152-734-280-865-740;;011-181-861-380-530;;096-866-746-743-864;;043-369-112-902-472;;063-745-038-278-465;;141-748-827-420-509;;063-479-285-377-285;;080-616-656-930-540;;027-314-878-690-911,RU;;CA;;JP;;KR;;PT;;PL;;CN;;ES;;AU;;DK;;FI;;BR;;WO;;MX;;US;;IL;;EP,27,095-418-251-758-452;;172-016-358-273-69X;;076-848-262-066-276;;135-481-838-122-470;;098-543-216-736-719;;086-571-364-434-926;;000-725-273-383-720;;056-496-205-069-225;;153-947-887-303-504;;058-375-562-836-105;;006-707-689-459-29X;;036-594-672-948-003;;175-848-266-125-914;;180-295-791-525-434;;030-642-208-724-01X;;099-848-387-400-56X;;015-109-212-500-52X;;026-234-878-168-692;;152-734-280-865-740;;011-181-861-380-530;;096-866-746-743-864;;043-369-112-902-472;;063-745-038-278-465;;141-748-827-420-509;;063-479-285-377-285;;080-616-656-930-540;;027-314-878-690-911,RU;;CA;;JP;;KR;;PT;;PL;;CN;;ES;;AU;;DK;;FI;;BR;;WO;;MX;;US;;IL;;EP,0,A61K31/41;;A61P25/08;;A61K31/41;;A61K31/16;;A61P25/08;;A61K31/41;;A61K31/16;;A61P25/08;;A61K31/41,A61K31/41;;A61K31/16;;A61P25/08;;A61P25/10,,16,16,036-449-495-631-839;;127-383-991-065-645;;053-279-259-339-315;;040-041-838-630-885;;033-810-217-802-066;;005-417-407-303-464;;092-409-304-367-057;;088-975-736-647-978;;104-868-911-812-235;;056-518-408-577-152;;004-001-377-853-979;;003-793-220-100-823;;008-387-721-476-405;;102-270-499-630-915;;061-442-537-366-127;;058-256-121-381-414,27505294;;10.1016/j.eplepsyres.2016.05.016;;10.1111/epi.13671;;28276064;;10.1016/b978-3-437-42523-3.00011-7;;29076416;;10.2174/1381612823666171024143541;;17304346;;10.1111/j.1535-7511.2007.00156.x;;pmc1797888;;26916017;;10.2174/1381612822666160226144200;;10.1038/nrd4126;;24052047;;23219031;;10.1016/j.eplepsyres.2012.10.001;;10.1007/978-1-4939-6774-2_19;;10.1016/j.eplepsyres.2015.01.001;;25769377;;10.2174/1381612823666170809100524;;28799516;;28017578;;10.1016/j.seizure.2016.11.022;;24635129;;pmc4027953;;10.1021/cb500108p;;pmc6112605;;28865303;;10.1016/j.eplepsyres.2017.08.013;;19337447;;pmc2646636;;10.2147/ndt.s1668;;20092980;;10.1016/j.eplepsyres.2009.12.005,"LÖSCHER WOLFGANG: ""Fit for purpose application of currently existing animal models in the discovery of novel epilepsy therapies"", EPILEPSY RESEARCH, ELSEVIER SCIENCE PUBLISHERS , AMSTERDAM, NL, vol. 126, 1 August 2016 (2016-08-01), pages 157 - 184, XP029709265, ISSN: 0920-1211, DOI: 10.1016/J.EPLEPSYRES.2016.05.016;;ROBERT S. FISHER; J. HELEN CROSS; CAROL D'SOUZA; JACQUELINE A. FRENCH; SHERYL R. HAUT; NORIMICHI HIGURASHI; EDOUARD HIRSCH; FLOOR : ""Instruction manual for the ILAE 2017 operational classification of seizure types"", EPILEPSIA, vol. 58, no. 4, 8 March 2017 (2017-03-08), New York , US , pages 531 - 542, XP071213725, ISSN: 0013-9580, DOI: 10.1111/epi.13671;;KLAUS AKTORIES , ULRICH FÖRSTERMANN , FRANZ HOFMANN , KLAUS STARKE: ""Allgemeine und spezielle Pharmakologie und Toxikologie"", 1 January 2013, ELSEVIER URBAN & FISCHER, ISBN: 978-3-437-42523-3, article T.J. FEUERSTEIN: ""Kapitel 11 - Antikonvulsiva, Konvulsiva – Pharmakotherapie der Epilepsien"", pages: 269 - 279, XP093252923, DOI: 10.1016/C2012-0-06299-0;;ESKIOGLOU ELISSAVET, PERRENOUD MATTHIEU P., RYVLIN PHILIPPE, NOVY JAN: ""Novel Treatment and New Drugs in Epilepsy Treatment"", CURRENT PHARMACEUTICAL DESIGN, vol. 23, no. 42, 15 February 2018 (2018-02-15), NL , pages 6389 - 6398, XP093252924, ISSN: 1381-6128, DOI: 10.2174/1381612823666171024143541;;CARL E STAFSTROM: "" Persistent Sodium Current and Its Role in Epilepsy"", EPILEPSY CURRENTS, vol. 7, no. 1, 1 January 2007 (2007-01-01), pages 15 - 22, XP055337014, DOI: 10.1111/j.1535-7511.2007.00156.x;;SHIKHA KUMARI, CHANDRA BHUSHAN MISHRA , MANISHA TIWARI: ""Polypharmacological Drugs in the Treatment of Epilepsy: The Comprehensive Review of Marketed and New Emerging Molecules"", CURRENT PHARMACEUTICAL DESIGN , vol. 22, no. 21, 1 January 2016 (2016-01-01), pages 3212 - 3225, XP093252928, ISSN: 1381-6128, DOI: 10.2174/1381612822666160226144200;;WOLFGANG LÖSCHER, HENRIK KLITGAARD, ROY E. TWYMAN, DIETER SCHMIDT: ""New avenues for anti-epileptic drug discovery and development"", NATURE REVIEWS DRUG DISCOVERY, vol. 12, no. 10, 1 October 2013 (2013-10-01), GB , pages 757 - 776, XP055253606, ISSN: 1474-1776, DOI: 10.1038/nrd4126;;BIALER, MEIR: ""Progress report on new antiepileptic drugs: A summary of the Eleventh Eilat Conference (EILAT XI)"", EPILEPSY RESEARCH, vol. 103, 1 January 2013 (2013-01-01), XP055691206, DOI: 10.1016/j.eplepsyres.2012.10.001;;MOHAMAD Z. KOUBEISSI, NABIL J. AZAR: ""Epilepsy Board Review"", 28 June 2017, SPRINGER, New York, ISBN: 978-1-4939-6772-8, article BASSEL ABOU-KHALIL: ""Other Pharmacological Therapies: Investigational Antiepileptic Drugs, Animal Models of Epilepsy, Hormonal Therapy, Immunotherapy"", pages: 241 - 245, XP093252936, DOI: 10.1007/978-1-4939-6774-2_19;;MEIR BIALER: ""Progress report on new antiepileptic drugs: A summary of the Twelfth Eilat Conference (EILAT XII)"", EPILEPSY RESEARCH, vol. 111, 1 March 2015 (2015-03-01), NL , pages 85 - 141, XP055611172, ISSN: 0920-1211, DOI: 10.1016/j.eplepsyres.2015.01.001;;GAETANO ZACCARA, D. SCHMIDT: ""Antiepileptic Drugs in Clinical Development: Differentiate or Die?"", CURRENT PHARMACEUTICAL DESIGN, vol. 23, no. 37, 9 February 2018 (2018-02-09), NL , pages 5593 - 5605, XP055507491, ISSN: 1381-6128, DOI: 10.2174/1381612823666170809100524;;GOLYALA AMBICA; KWAN PATRICK: ""Drug development for refractory epilepsy: The past 25 years and beyond"", SEIZURE, vol. 44, 6 December 2016 (2016-12-06), GB , pages 147 - 156, XP029901803, ISSN: 1059-1311, DOI: 10.1016/j.seizure.2016.11.022;;JOHN GILCHRIST , STACEY DUTTON , MARCELO DIAZ-BUSTAMANTE , ANNIE MCPHERSON , NICOLAS OLIVARES , JEET KALIA , ANDREW ESCAYG ,FRANK : ""Na v 1.1 Modulation by a Novel Triazole Compound Attenuates Epileptic Seizures in Rodents"", ACS CHEMICAL BIOLOGY, vol. 9, no. 5, 16 May 2014 (2014-05-16), pages 1204 - 1212, XP055362820, ISSN: 1554-8929, DOI: 10.1021/cb500108p;;KANG JING-QIONG: ""Defects at the crossroads of GABAergic signaling in generalized genetic epilepsies"", EPILEPSY RESEARCH (AUTHOR MANUSCRIPT), vol. 137, 1 November 2017 (2017-11-01), NL , pages 1 - 24, XP093252943, ISSN: 0920-1211, DOI: 10.1016/j.eplepsyres.2017.08.013;;KENOU VAN RIJCKEVORSEL: ""Treatment of Lennox-Gastaut syndrome: overview and recent findings"", NEUROPSYCHIATRIC DISEASE AND TREATMENT, vol. 4, no. 6, 1 December 2008 (2008-12-01), pages 1001 - 1019, XP093252950, DOI: 10.2147/ndt.s1668;;OZLEM AKMAN , TAMER DEMIRALP , NURBAY ATES , FILIZ YILMAZ ONAT: ""Electroencephalographic differences between WAG/Rij and GAERS rat models of absence epilepsy"", EPILEPSY RESEARCH, vol. 89, no. 2-3, 1 May 2010 (2010-05-01), NL , pages 185 - 193, XP026996985, ISSN: 0920-1211, DOI: 10.1016/j.eplepsyres.2009.12.005",ACTIVE
3,JP,A,JP 2023085469 A,098-543-216-736-719,2023-06-20,2023,JP 2023061633 A,2023-04-05,JP 2020544727 A;;KR 20170151248 A;;KR 2018013761 W,2017-11-14,"USE OF CARBAMATE COMPOUND FOR PREVENTING, ALLEVIATING OR TREATING ABSENCE SEIZURE OR EPILEPSY SHOWING ABSENCE SEIZURE","To provide a medicine used for preventing, alleviating or treating absence seizure or epilepsy showing absence seizure.SOLUTION: The present invention relates to a medicine containing a carbamate compound of formula (1), or a pharmaceutically acceptable salt, a solvate or a hydrate thereof for preventing, alleviating or treating epilepsy showing absence seizure. The epilepsy showing absence seizures is selected from the group consisting of child absence epilepsy, epilepsy with myoclonic absence, juvenile absence epilepsy, juvenile myoclonic epilepsy, Jeavons syndrome (eyelid myoclonia with absence), and genetic generalized epilepsy with phantom absence.SELECTED DRAWING: None",SK BIOPHARMACEUTICALS CO LTD,SHIN HYE WON,,https://lens.org/098-543-216-736-719,Patent Application,no,0,0,27,095-418-251-758-452;;172-016-358-273-69X;;076-848-262-066-276;;135-481-838-122-470;;098-543-216-736-719;;086-571-364-434-926;;000-725-273-383-720;;056-496-205-069-225;;153-947-887-303-504;;058-375-562-836-105;;006-707-689-459-29X;;036-594-672-948-003;;175-848-266-125-914;;180-295-791-525-434;;030-642-208-724-01X;;099-848-387-400-56X;;015-109-212-500-52X;;026-234-878-168-692;;152-734-280-865-740;;011-181-861-380-530;;096-866-746-743-864;;043-369-112-902-472;;063-745-038-278-465;;141-748-827-420-509;;063-479-285-377-285;;080-616-656-930-540;;027-314-878-690-911,RU;;CA;;JP;;KR;;PT;;PL;;CN;;ES;;AU;;DK;;FI;;BR;;WO;;MX;;US;;IL;;EP,27,095-418-251-758-452;;172-016-358-273-69X;;076-848-262-066-276;;135-481-838-122-470;;098-543-216-736-719;;086-571-364-434-926;;000-725-273-383-720;;056-496-205-069-225;;153-947-887-303-504;;058-375-562-836-105;;006-707-689-459-29X;;036-594-672-948-003;;175-848-266-125-914;;180-295-791-525-434;;030-642-208-724-01X;;099-848-387-400-56X;;015-109-212-500-52X;;026-234-878-168-692;;152-734-280-865-740;;011-181-861-380-530;;096-866-746-743-864;;043-369-112-902-472;;063-745-038-278-465;;141-748-827-420-509;;063-479-285-377-285;;080-616-656-930-540;;027-314-878-690-911,RU;;CA;;JP;;KR;;PT;;PL;;CN;;ES;;AU;;DK;;FI;;BR;;WO;;MX;;US;;IL;;EP,0,A61K31/41;;A61P25/08;;A61K31/41;;A61K31/16;;A61P25/08;;A61K31/41;;A61K31/16;;A61P25/08;;A61K31/41,A61K31/41;;A61K9/08;;A61K9/10;;A61K9/14;;A61K9/16;;A61K9/20;;A61K9/48;;A61P25/08,,0,0,,,,ACTIVE
4,US,A1,US 2020/0352907 A1,096-866-746-743-864,2020-11-12,2020,US 201816763636 A,2018-11-13,KR 20170151248 A;;KR 2018013761 W,2017-11-14,"Use Of Carbamate Compound For Preventing, Alleviating Or Treating Absence Seizure Or Epilepsy Showing Absence Seizure","The present invention relates to a use of a carbamate compound represented by chemical formula 1, or a pharmaceutically acceptable salt, a solvate or a hydrate thereof for preventing, alleviating or treating absence seizure or epilepsy showing absence seizure.",SK BIOPHARMACEUTICALS CO LTD,SHIN HYE WON,SK BIOPHARMACEUTICALS CO. LTD (2020-05-22),https://lens.org/096-866-746-743-864,Patent Application,yes,1,0,27,095-418-251-758-452;;172-016-358-273-69X;;076-848-262-066-276;;135-481-838-122-470;;098-543-216-736-719;;086-571-364-434-926;;000-725-273-383-720;;056-496-205-069-225;;153-947-887-303-504;;058-375-562-836-105;;006-707-689-459-29X;;036-594-672-948-003;;175-848-266-125-914;;180-295-791-525-434;;030-642-208-724-01X;;099-848-387-400-56X;;015-109-212-500-52X;;026-234-878-168-692;;152-734-280-865-740;;011-181-861-380-530;;096-866-746-743-864;;043-369-112-902-472;;063-745-038-278-465;;141-748-827-420-509;;063-479-285-377-285;;080-616-656-930-540;;027-314-878-690-911,RU;;CA;;JP;;KR;;PT;;PL;;CN;;ES;;AU;;DK;;FI;;BR;;WO;;MX;;US;;IL;;EP,27,095-418-251-758-452;;172-016-358-273-69X;;076-848-262-066-276;;135-481-838-122-470;;098-543-216-736-719;;086-571-364-434-926;;000-725-273-383-720;;056-496-205-069-225;;153-947-887-303-504;;058-375-562-836-105;;006-707-689-459-29X;;036-594-672-948-003;;175-848-266-125-914;;180-295-791-525-434;;030-642-208-724-01X;;099-848-387-400-56X;;015-109-212-500-52X;;026-234-878-168-692;;152-734-280-865-740;;011-181-861-380-530;;096-866-746-743-864;;043-369-112-902-472;;063-745-038-278-465;;141-748-827-420-509;;063-479-285-377-285;;080-616-656-930-540;;027-314-878-690-911,RU;;CA;;JP;;KR;;PT;;PL;;CN;;ES;;AU;;DK;;FI;;BR;;WO;;MX;;US;;IL;;EP,0,A61K31/41;;A61P25/08;;A61K31/41;;A61K31/16;;A61P25/08;;A61K31/41;;A61K31/16;;A61P25/08;;A61K31/41,A61K31/41;;A61P25/08,,6,5,102-270-499-630-915;;056-518-408-577-152;;008-387-721-476-405;;102-270-499-630-915;;061-442-537-366-127,pmc6112605;;10.1016/j.eplepsyres.2017.08.013;;28865303;;25769377;;10.1016/j.eplepsyres.2015.01.001;;10.1021/cb500108p;;24635129;;pmc4027953;;pmc6112605;;10.1016/j.eplepsyres.2017.08.013;;28865303;;19337447;;10.2147/ndt.s1668;;pmc2646636,"Kang (Epilepsy Research 137 (2017) 9–18, Available online 26 August 2017);;Rijckevorsel (Neuropsychiatr Dis Treat. 2008 Dec; 4(6): 1001–1019);;M. Bialer, et al. Progress report on new antiepileptic drugs: A summary of the Twelfth Eilat Conference (EILAT XII), Epilepsy Research, 2015, V. 111, IS. 0920-1211, P. 85-141, doi.org/10.1016/j.eplepsyres.2015.01.001. (Year: 2015);;Gilchrist J, et al. Nav1.1 modulation by a novel triazole compound attenuates epileptic seizures in rodents. ACS Chem Biol. 2014 May 16;9(5):1204-12. doi: 10.1021/cb500108p. (Year: 2014);;J. Kang, Defects at the crossroads of GABAergic signaling in generalized genetic epilepsies, Epilepsy Research, 2017, Volume 137, Pages 9-18, ISSN 0920-1211, doi.org/10.1016/j.eplepsyres.2017.08.013. (Available online 26 August 2017). (Year: 2017);;V. Rijckevorsel K. Treatment of Lennox-Gastaut syndrome: overview and recent findings. Neuropsychiatr Dis Treat. 2008 Dec;4(6):1001-19. doi: 10.2147/ndt.s1668. (Year: 2008)",PENDING
5,TW,A,TW 201717929 A,010-950-856-027-860,2017-06-01,2017,TW 105116059 A,2016-05-23,KR 20150071996 A,2015-05-22,"Medicament comprising carisbamate, and its use for prevention, relief or treatment of pain or epilepsy","The present invention relates to a medicament comprising carisbamate, and its use for preventing, relieving or treating pain or epilepsy, in more detail, to a medicament and a pharmaceutical composition comprising at least one selected from gabapentin and pregabalin with carisbamate, and its use for preventing, relieving or treating pain or epilepsy.",SK BIOPHARMACEUTICALS CO LTD,YI HAN-JU;;HWANG SUN-GWAN;;JO MIN-JAE,,https://lens.org/010-950-856-027-860,Patent of Addition,no,0,0,3,010-950-856-027-860;;016-967-837-165-431;;103-855-602-445-639,KR;;WO;;TW,3,010-950-856-027-860;;016-967-837-165-431;;103-855-602-445-639,KR;;WO;;TW,0,A61K9/00;;A61K31/195;;A61K31/197;;A61K31/27;;A61K31/195;;A61K9/0019;;A61K9/0021;;A61K31/197;;A61K31/27,A61K31/195;;A61K31/197;;A61K31/27;;A61P25/04;;A61P25/08,,0,0,,,,PENDING
6,WO,A1,WO 2016/190638 A1,016-967-837-165-431,2016-12-01,2016,KR 2016005441 W,2016-05-23,KR 20150071996 A,2015-05-22,"MEDICAMENT COMPRISING CARISBAMATE, AND USE THEREOF FOR PREVENTION, ALLEVIATION OR TREATMENT OF PAIN OR EPILEPSY","The present invention relates to a medicament comprising carisbamate, and use thereof for prevention, alleviation or treatment of pain or epilepsy and, more specifically, relates to a medicament and a pharmaceutical composition comprising: carisbamate; and at least one selected from among gabapentin and pregabalin, and use thereof for treating pain or epilepsy.",SK BIOPHARMACEUTICALS CO LTD,YI HAN JU;;HWANG SUN GWAN;;JO MIN JAE,,https://lens.org/016-967-837-165-431,Patent Application,yes,2,4,3,010-950-856-027-860;;016-967-837-165-431;;103-855-602-445-639,KR;;WO;;TW,3,010-950-856-027-860;;016-967-837-165-431;;103-855-602-445-639,KR;;WO;;TW,0,A61K9/00;;A61K31/195;;A61K31/197;;A61K31/27;;A61K31/195;;A61K9/0019;;A61K9/0021;;A61K31/197;;A61K31/27,A61K31/195;;A61K9/00;;A61K31/197;;A61K31/27,,3,3,036-914-602-923-53X;;034-677-395-068-42X;;010-336-763-199-356,10.1111/papr.12080;;23692321;;17199023;;10.1016/j.nurt.2006.11.016;;pmc7479705;;19222595;;10.1111/j.1526-4610.2008.01326.x,"SMITH, T. MD ET AL.: ""Efficacy and Safety of Carisbamate in Patients with Diabetic Neuropathy or Postherpetic Neuralgia: Results from 3 Randomized, Double-Blind Placebo-Controlled Trials"", PAIN PRACT., vol. 14, no. 4, 2014, pages 332 - 342, XP055332726;;NOVAK, G. P. ET AL.: ""Carisbamate (RWJ-333369"", NEUROTHERAPEUTICS, vol. 4, no. 1, January 2007 (2007-01-01), pages 106 - 109, XP005735284;;CADY, R. K. MD ET AL.: ""Evaluation of Carisbamate for the Treatment of Migraine in a Randomized, Double-Blind Trial"", AMERICAN HEADACHE SOCIETY, vol. 49, no. 2, February 2009 (2009-02-01), pages 216 - 226, XP055332727",PENDING
7,KR,A,KR 20160137443 A,103-855-602-445-639,2016-11-30,2016,KR 20160062690 A,2016-05-23,KR 20150071996 A,2015-05-22,MEDICAMENT COMPRISING CARISBAMATE AND ITS USE FOR PREVENTION RELIEF OR TREATMENT OF PAIN OR EPILEPSY,"The present invention relates to a medicament comprising carisbamate, and uses for treatment of pain or epilepsy and, more specifically, to a medicament and a pharmaceutical composition comprising carisbamate and one or more selected from gabapentin and pregabalin, and to uses for treatment of pain or epilepsy.",SK BIOPHARMACEUTICALS CO LTD,YI HAN JU;;HWANG SUN GWAN;;JO MIN JAE,,https://lens.org/103-855-602-445-639,Patent Application,no,0,0,3,010-950-856-027-860;;016-967-837-165-431;;103-855-602-445-639,KR;;WO;;TW,3,010-950-856-027-860;;016-967-837-165-431;;103-855-602-445-639,KR;;WO;;TW,0,A61K9/00;;A61K31/195;;A61K31/197;;A61K31/27;;A61K31/195;;A61K9/0019;;A61K9/0021;;A61K31/197;;A61K31/27,A61K31/195;;A61K9/00;;A61K31/197;;A61K31/27,,0,0,,,,DISCONTINUED
8,CN,A,CN 111432812 A,058-375-562-836-105,2020-07-17,2020,CN 201880073833 A,2018-11-13,KR 20170151248 A;;KR 2018013761 W,2017-11-14,"USE OF CARBAMATE COMPOUND FOR PREVENTING, ALLEVIATING OR TREATING ABSENCE SEIZURE OR EPILEPSY SHOWING ABSENCE SEIZURE","The present invention relates to a use of a carbamate compound represented by chemical formula 1, or a pharmaceutically acceptable salt, a solvate or a hydrate thereof for preventing, alleviating or treating absence seizure or epilepsy showing absence seizure.",SK BIOPHARMACEUTICALS CO LTD,SHIN HYE WON,,https://lens.org/058-375-562-836-105,Patent Application,no,3,1,27,095-418-251-758-452;;172-016-358-273-69X;;076-848-262-066-276;;135-481-838-122-470;;098-543-216-736-719;;086-571-364-434-926;;000-725-273-383-720;;056-496-205-069-225;;153-947-887-303-504;;058-375-562-836-105;;006-707-689-459-29X;;036-594-672-948-003;;175-848-266-125-914;;180-295-791-525-434;;030-642-208-724-01X;;099-848-387-400-56X;;015-109-212-500-52X;;026-234-878-168-692;;152-734-280-865-740;;011-181-861-380-530;;096-866-746-743-864;;043-369-112-902-472;;063-745-038-278-465;;141-748-827-420-509;;063-479-285-377-285;;080-616-656-930-540;;027-314-878-690-911,RU;;CA;;JP;;KR;;PT;;PL;;CN;;ES;;AU;;DK;;FI;;BR;;WO;;MX;;US;;IL;;EP,27,095-418-251-758-452;;172-016-358-273-69X;;076-848-262-066-276;;135-481-838-122-470;;098-543-216-736-719;;086-571-364-434-926;;000-725-273-383-720;;056-496-205-069-225;;153-947-887-303-504;;058-375-562-836-105;;006-707-689-459-29X;;036-594-672-948-003;;175-848-266-125-914;;180-295-791-525-434;;030-642-208-724-01X;;099-848-387-400-56X;;015-109-212-500-52X;;026-234-878-168-692;;152-734-280-865-740;;011-181-861-380-530;;096-866-746-743-864;;043-369-112-902-472;;063-745-038-278-465;;141-748-827-420-509;;063-479-285-377-285;;080-616-656-930-540;;027-314-878-690-911,RU;;CA;;JP;;KR;;PT;;PL;;CN;;ES;;AU;;DK;;FI;;BR;;WO;;MX;;US;;IL;;EP,0,A61K31/41;;A61P25/08;;A61K31/41;;A61K31/16;;A61P25/08;;A61K31/41;;A61K31/16;;A61P25/08;;A61K31/41,A61K31/41;;A61K31/16,,2,2,056-518-408-577-152;;003-793-220-100-823,25769377;;10.1016/j.eplepsyres.2015.01.001;;10.1016/j.seizure.2016.11.022;;28017578,"BIALER M, ET AL.: ""Progress report on new antiepileptic drugs: a summary of the Twelfth Eilat Conference (EILAT XII)"", 《EPILEPSY RESEARCH》;;GOLYALA A, KWAN P.: ""Drug development for refractory epilepsy: the past 25 years and beyond"", 《SEIZURE》",PENDING
9,CA,A1,CA 3081223 A1,056-496-205-069-225,2019-05-23,2019,CA 3081223 A,2018-11-13,KR 20170151248 A;;KR 2018013761 W,2017-11-14,"USE OF CARBAMATE COMPOUND FOR PREVENTING, ALLEVIATING OR TREATING ABSENCE SEIZURE OR EPILEPSY SHOWING ABSENCE SEIZURE","The present invention relates to a use of a carbamate compound represented by chemical formula 1, or a pharmaceutically acceptable salt, a solvate or a hydrate thereof for preventing, alleviating or treating absence seizure or epilepsy showing absence seizure.",SK BIOPHARMACEUTICALS CO LTD,SHIN HYE WON,,https://lens.org/056-496-205-069-225,Patent Application,no,0,0,27,095-418-251-758-452;;172-016-358-273-69X;;076-848-262-066-276;;135-481-838-122-470;;098-543-216-736-719;;086-571-364-434-926;;000-725-273-383-720;;056-496-205-069-225;;153-947-887-303-504;;058-375-562-836-105;;006-707-689-459-29X;;036-594-672-948-003;;175-848-266-125-914;;180-295-791-525-434;;030-642-208-724-01X;;099-848-387-400-56X;;015-109-212-500-52X;;026-234-878-168-692;;152-734-280-865-740;;011-181-861-380-530;;096-866-746-743-864;;043-369-112-902-472;;063-745-038-278-465;;141-748-827-420-509;;063-479-285-377-285;;080-616-656-930-540;;027-314-878-690-911,RU;;CA;;JP;;KR;;PT;;PL;;CN;;ES;;AU;;DK;;FI;;BR;;WO;;MX;;US;;IL;;EP,27,095-418-251-758-452;;172-016-358-273-69X;;076-848-262-066-276;;135-481-838-122-470;;098-543-216-736-719;;086-571-364-434-926;;000-725-273-383-720;;056-496-205-069-225;;153-947-887-303-504;;058-375-562-836-105;;006-707-689-459-29X;;036-594-672-948-003;;175-848-266-125-914;;180-295-791-525-434;;030-642-208-724-01X;;099-848-387-400-56X;;015-109-212-500-52X;;026-234-878-168-692;;152-734-280-865-740;;011-181-861-380-530;;096-866-746-743-864;;043-369-112-902-472;;063-745-038-278-465;;141-748-827-420-509;;063-479-285-377-285;;080-616-656-930-540;;027-314-878-690-911,RU;;CA;;JP;;KR;;PT;;PL;;CN;;ES;;AU;;DK;;FI;;BR;;WO;;MX;;US;;IL;;EP,0,A61K31/41;;A61P25/08;;A61K31/41;;A61K31/16;;A61P25/08;;A61K31/41;;A61K31/16;;A61P25/08;;A61K31/41,A61K31/41;;A61K31/16,,0,0,,,,PENDING
