97,US,A1,US 2015/0252398 A1,193-394-402-499-566,2015-09-10,2015,US 201514719728 A,2015-05-22,US 201514719728 A;;US 201313776964 A;;US 90426710 A;;US 25186709 P,2009-10-15,METHOD FOR PREPARATION OF CARBAMIC ACID (R)-1-ARYL-2-TETRAZOLYL-ETHYL ESTER,"Disclosed is a method for the preparation of carbamic acid (R)-1-aryl-2-tetrazolyl-ethyl esters, comprising the enantioselective enzyme reduction of a 1-aryl-2-tetrazolyl-ethyl ketone to form a (R)-1-aryl-2-tetrazolyl-ethyl alcohol and the carbamation of said alcohol.",SK BIOPHARMACEUTICALS CO LTD,LIM SANG CHUL;;UHM MOO YONG;;LEE DAE WON;;KIM HUI HO;;LEE DONG HO;;LEE HYUN SEOK,,https://lens.org/193-394-402-499-566,Patent Application,yes,0,1,34,016-197-744-023-399;;038-532-396-776-768;;117-360-948-134-305;;100-961-428-414-334;;126-300-092-826-786;;010-230-015-612-963;;055-058-684-385-949;;034-404-087-195-992;;085-485-945-533-853;;193-170-982-419-952;;151-820-942-918-798;;094-952-948-890-748;;095-655-236-166-570;;118-596-803-384-538;;072-679-912-699-324;;114-195-532-650-52X;;109-515-102-992-078;;041-488-748-194-116;;069-796-278-488-670;;136-889-561-047-716;;011-196-245-292-379;;121-249-289-774-323;;105-513-255-591-588;;026-150-348-487-268;;118-470-678-781-636;;149-849-678-101-400;;171-411-424-337-617;;115-870-633-855-244;;037-806-165-788-023;;193-394-402-499-566;;155-040-750-977-927;;044-652-973-822-810;;182-096-519-644-558;;157-158-332-478-988,CA;;RU;;KR;;JP;;ZA;;HU;;CN;;PL;;CL;;MY;;ES;;AU;;BR;;WO;;MX;;US;;HK;;EP;;IL,34,016-197-744-023-399;;038-532-396-776-768;;117-360-948-134-305;;100-961-428-414-334;;126-300-092-826-786;;010-230-015-612-963;;055-058-684-385-949;;034-404-087-195-992;;085-485-945-533-853;;193-170-982-419-952;;151-820-942-918-798;;094-952-948-890-748;;095-655-236-166-570;;118-596-803-384-538;;072-679-912-699-324;;114-195-532-650-52X;;109-515-102-992-078;;041-488-748-194-116;;069-796-278-488-670;;136-889-561-047-716;;011-196-245-292-379;;121-249-289-774-323;;105-513-255-591-588;;026-150-348-487-268;;118-470-678-781-636;;149-849-678-101-400;;171-411-424-337-617;;115-870-633-855-244;;037-806-165-788-023;;193-394-402-499-566;;155-040-750-977-927;;044-652-973-822-810;;182-096-519-644-558;;157-158-332-478-988,CA;;RU;;KR;;JP;;ZA;;HU;;CN;;PL;;CL;;MY;;ES;;AU;;BR;;WO;;MX;;US;;HK;;EP;;IL,8,A61P25/00;;C07D257/04;;C07D257/06;;A61K31/41;;C12P17/12;;C12P17/10;;C07D257/04,C12P17/10,,0,0,,,,ACTIVE
98,US,A1,US 2014/0073018 A1,109-515-102-992-078,2014-03-13,2014,US 201313776964 A,2013-02-26,US 201313776964 A;;US 90426710 A;;US 25186709 P,2009-10-15,Method for Preparation of Carbamic Acid (R)-1-Aryl-2 Tetrazolyl-Ethyl Ester,"Disclosed is a method for the preparation of carbamic acid (R)-1-aryl-2-tetrazolyl-ethyl esters, comprising the enantioselective enzyme reduction of a 1-aryl-2-tetrazolyl-ethyl ketone to form a (R)-1-aryl-2-tetrazolyl-ethyl alcohol and the carbamation of said alcohol.",SK BIOPHARMACEUTICALS CO LTD,LIM SANG CHUL;;UHM MOO YONG;;LEE DAE WON;;KIM HUI HO;;LEE DONG HO;;LEE HYUN SEOK,,https://lens.org/109-515-102-992-078,Patent Application,yes,2,1,34,016-197-744-023-399;;038-532-396-776-768;;117-360-948-134-305;;100-961-428-414-334;;126-300-092-826-786;;010-230-015-612-963;;055-058-684-385-949;;034-404-087-195-992;;085-485-945-533-853;;193-170-982-419-952;;151-820-942-918-798;;094-952-948-890-748;;095-655-236-166-570;;118-596-803-384-538;;072-679-912-699-324;;114-195-532-650-52X;;109-515-102-992-078;;041-488-748-194-116;;069-796-278-488-670;;136-889-561-047-716;;011-196-245-292-379;;121-249-289-774-323;;105-513-255-591-588;;026-150-348-487-268;;118-470-678-781-636;;149-849-678-101-400;;171-411-424-337-617;;115-870-633-855-244;;037-806-165-788-023;;193-394-402-499-566;;155-040-750-977-927;;044-652-973-822-810;;182-096-519-644-558;;157-158-332-478-988,CA;;RU;;KR;;JP;;ZA;;HU;;CN;;PL;;CL;;MY;;ES;;AU;;BR;;WO;;MX;;US;;HK;;EP;;IL,34,016-197-744-023-399;;038-532-396-776-768;;117-360-948-134-305;;100-961-428-414-334;;126-300-092-826-786;;010-230-015-612-963;;055-058-684-385-949;;034-404-087-195-992;;085-485-945-533-853;;193-170-982-419-952;;151-820-942-918-798;;094-952-948-890-748;;095-655-236-166-570;;118-596-803-384-538;;072-679-912-699-324;;114-195-532-650-52X;;109-515-102-992-078;;041-488-748-194-116;;069-796-278-488-670;;136-889-561-047-716;;011-196-245-292-379;;121-249-289-774-323;;105-513-255-591-588;;026-150-348-487-268;;118-470-678-781-636;;149-849-678-101-400;;171-411-424-337-617;;115-870-633-855-244;;037-806-165-788-023;;193-394-402-499-566;;155-040-750-977-927;;044-652-973-822-810;;182-096-519-644-558;;157-158-332-478-988,CA;;RU;;KR;;JP;;ZA;;HU;;CN;;PL;;CL;;MY;;ES;;AU;;BR;;WO;;MX;;US;;HK;;EP;;IL,8,A61P25/00;;C07D257/04;;C07D257/06;;A61K31/41;;C12P17/12;;C12P17/10;;C07D257/04,C12P17/10,435/121,0,0,,,,ACTIVE
99,US,B2,US 9434970 B2,114-195-532-650-52X,2016-09-06,2016,US 201514719728 A,2015-05-22,US 201514719728 A;;US 201313776964 A;;US 90426710 A;;US 25186709 P,2009-10-15,Method for preparation of carbamic acid (R)-1-aryl-2-tetrazolyl-ethyl ester,"Disclosed is a method for the preparation of carbamic acid (R)-1-aryl-2-tetrazolyl-ethyl esters, comprising the enantioselective enzyme reduction of a 1-aryl-2-tetrazolyl-ethyl ketone to form a (R)-1-aryl-2-tetrazolyl-ethyl alcohol and the carbamation of said alcohol.",SK BIOPHARMACEUTICALS CO LTD,LIM SANG CHUL;;UHM MOO YONG;;LEE DAE WON;;KIM HUI HO;;LEE DONG HO;;LEE HYUN SEOK,,https://lens.org/114-195-532-650-52X,Granted Patent,yes,88,1,34,016-197-744-023-399;;038-532-396-776-768;;117-360-948-134-305;;100-961-428-414-334;;126-300-092-826-786;;010-230-015-612-963;;055-058-684-385-949;;034-404-087-195-992;;085-485-945-533-853;;193-170-982-419-952;;151-820-942-918-798;;094-952-948-890-748;;095-655-236-166-570;;118-596-803-384-538;;072-679-912-699-324;;114-195-532-650-52X;;109-515-102-992-078;;041-488-748-194-116;;069-796-278-488-670;;136-889-561-047-716;;011-196-245-292-379;;121-249-289-774-323;;105-513-255-591-588;;026-150-348-487-268;;118-470-678-781-636;;149-849-678-101-400;;171-411-424-337-617;;115-870-633-855-244;;037-806-165-788-023;;193-394-402-499-566;;155-040-750-977-927;;044-652-973-822-810;;182-096-519-644-558;;157-158-332-478-988,CA;;RU;;KR;;JP;;ZA;;HU;;CN;;PL;;CL;;MY;;ES;;AU;;BR;;WO;;MX;;US;;HK;;EP;;IL,34,016-197-744-023-399;;038-532-396-776-768;;117-360-948-134-305;;100-961-428-414-334;;126-300-092-826-786;;010-230-015-612-963;;055-058-684-385-949;;034-404-087-195-992;;085-485-945-533-853;;193-170-982-419-952;;151-820-942-918-798;;094-952-948-890-748;;095-655-236-166-570;;118-596-803-384-538;;072-679-912-699-324;;114-195-532-650-52X;;109-515-102-992-078;;041-488-748-194-116;;069-796-278-488-670;;136-889-561-047-716;;011-196-245-292-379;;121-249-289-774-323;;105-513-255-591-588;;026-150-348-487-268;;118-470-678-781-636;;149-849-678-101-400;;171-411-424-337-617;;115-870-633-855-244;;037-806-165-788-023;;193-394-402-499-566;;155-040-750-977-927;;044-652-973-822-810;;182-096-519-644-558;;157-158-332-478-988,CA;;RU;;KR;;JP;;ZA;;HU;;CN;;PL;;CL;;MY;;ES;;AU;;BR;;WO;;MX;;US;;HK;;EP;;IL,8,A61P25/00;;C07D257/04;;C07D257/06;;A61K31/41;;C12P17/12;;C12P17/10;;C07D257/04,C12P17/10;;C07D257/04,,16,4,010-680-137-385-664;;139-582-685-904-567;;001-580-232-559-357;;005-903-507-321-057,10.1016/j.tet.2007.12.020;;10.1016/j.tetasy.2008.12.035;;19251421;;10.1016/j.bmc.2009.02.004;;10.1016/s0957-4166(01)00020-9,"Hobuss et al. (2008) ""Catalytic enantioselective borane reduction of arylketones with pinene-derived amino alcohols,"" Tetrahedron, 64(8):1635-1640.;;Matsuda, T. et al. (2009) ""Recent progress in biocatalysis for asymmetric oxidation and reduction."" Tetrahedron: Asymmetry. 20(5):513-557.;;Rostom et al., (2009) ""Azole antimicrobial pharmacophore-based tetrazoles: Synthesis and biological evaluation as potential antimicrobial and anticonvulsant agents,"" Bioorganic & Medicinal Chemistry 17:2410-2422.;;Yadav et al., (2001) ""A facile synthesis of (R)-(-)-2-azido-1-arylethanols from 2-azido-1-arylketones using baker's yeast,"" Tetrahedron: Asymmetry, 12(1):63-67.;;Extended European Search Opinion dated Oct. 22, 2012 in the corresponding European Patent Application No. 09846577.6.;;International Search Report and Written Opinion dated Apr. 28, 2010 in the corresponding PCT Application No. PCT/KR2009/005906.;;International Search Report and Written Opinion dated Jul. 11, 2011 in the related PCT Application No. PCT/KR2010/007069.;;Office Action dated Nov. 3, 2011 issued in U.S. Appl. No. 12/578,709.;;Office Action dated Jan. 31, 2012 issued in U.S. Appl. No. 12/578,709.;;Office Action dated Apr. 19, 2012 issued in U.S. Appl. No. 12/904,267.;;Office Action dated May 18, 2012 issued in U.S. Appl. No. 12/904,267.;;Office Action dated Jun. 29, 2012 issued in U.S. Appl. No. 12/578,709.;;Notice of Allowance and Fees Due dated Jan. 3, 2013 issued in U.S. Appl. No. 12/904,267.;;Notice of Allowance and Fees Due dated Feb. 7, 2013 issued in U.S. Appl. No. 12/904,267.;;Notice of Allowance and Fees Due dated May 31, 2013 issued in U.S. Appl. No. 12/578,709.;;Notice of Allowance and Fees Due dated Feb. 25, 2015 issued in U.S. Appl. No. 13/776,964.",ACTIVE
100,EP,B1,EP 2445890 B1,081-782-803-753-24X,2015-05-06,2015,EP 09846577 A,2009-10-14,KR 2009005906 W;;KR 20090055576 A,2009-06-22,METHOD FOR PREPARATION OF CARBAMIC ACID (R)-1-ARYL-2-TETRAZOLYL-ETHYL ESTER,,SK BIOPHARMACEUTICALS CO LTD,LIM SANG CHUL;;UHM MOO YONG;;CHO NAHM RYUNE;;LEE DAE WON;;LEE JU YOUNG;;KIM HUI HO;;LEE DONG HO;;LEE HYUN SEOK;;LEE SE II,,https://lens.org/081-782-803-753-24X,Granted Patent,yes,3,2,28,007-555-136-346-451;;158-653-493-805-69X;;168-903-366-391-350;;060-834-915-468-988;;054-191-736-617-817;;047-587-052-154-169;;146-543-770-179-090;;187-264-533-757-139;;090-700-469-438-627;;195-978-189-312-759;;133-378-285-197-342;;081-782-803-753-24X;;132-439-277-743-024;;057-725-855-822-461;;012-511-230-387-803;;072-608-951-910-067;;099-311-434-759-20X;;046-065-801-072-546;;184-576-115-196-504;;069-876-936-965-214;;084-572-481-959-985;;139-626-924-540-871;;123-980-927-505-01X;;162-862-772-618-366;;192-577-110-026-922;;084-186-970-132-131;;140-397-656-885-695;;001-508-602-639-922,RU;;CA;;JP;;KR;;ZA;;CN;;PL;;CL;;MY;;ES;;AU;;BR;;MX;;WO;;US;;EP;;IL,28,007-555-136-346-451;;158-653-493-805-69X;;168-903-366-391-350;;060-834-915-468-988;;054-191-736-617-817;;047-587-052-154-169;;146-543-770-179-090;;187-264-533-757-139;;090-700-469-438-627;;195-978-189-312-759;;133-378-285-197-342;;081-782-803-753-24X;;132-439-277-743-024;;057-725-855-822-461;;012-511-230-387-803;;072-608-951-910-067;;099-311-434-759-20X;;046-065-801-072-546;;184-576-115-196-504;;069-876-936-965-214;;084-572-481-959-985;;139-626-924-540-871;;123-980-927-505-01X;;162-862-772-618-366;;192-577-110-026-922;;084-186-970-132-131;;140-397-656-885-695;;001-508-602-639-922,RU;;CA;;JP;;KR;;ZA;;CN;;PL;;CL;;MY;;ES;;AU;;BR;;MX;;WO;;US;;EP;;IL,0,C07D257/04;;C12P17/10;;C07D257/06;;C07D413/12;;C12P17/12;;C07D257/04;;C12P17/10,C07D257/06,,2,0,,,"HOBUSZ ET AL: ""Catalytic enantioselective borane reduction of arylketones with pinene-derived amino alcohols"", TETRAHEDRON, ELSEVIER SCIENCE PUBLISHERS, AMSTERDAM, NL, vol. 64, no. 8, 14 December 2007 (2007-12-14), pages 1635-1640, XP022424493, ISSN: 0040-4020, DOI: 10.1016/J.TET.2007.12.020;;YADAV J S ET AL: ""A facile synthesis of (R)-(-)-2-azido-1-arylethanols from 2-azido-1-arylketones using baker's yeast"", TETRAHEDRON ASYMMETRY, PERGAMON PRESS LTD, OXFORD, GB, vol. 12, no. 1, 5 February 2001 (2001-02-05), pages 63-67, XP004229364, ISSN: 0957-4166, DOI: 10.1016/S0957-4166(01)00020-9",ACTIVE
101,EP,B1,EP 1928451 B1,090-569-071-311-350,2011-12-28,2011,EP 05775692 A,2005-07-26,US 2005/0026439 W,2005-07-26,METHODS FOR TREATING SUBSTANCE-RELATED DISORDERS,,SK BIOPHARMACEUTICALS CO LTD,PLATA-SALAMAN CARLOS R;;ZHAO BOYU;;TWYMAN ROY E,"SK BIOPHARMACEUTICALS CO., LTD (2011-10-05)",https://lens.org/090-569-071-311-350,Granted Patent,yes,4,0,21,105-192-163-541-239;;134-020-851-035-648;;180-924-000-952-106;;024-751-188-275-450;;016-383-533-535-529;;040-061-733-114-911;;083-707-604-623-680;;134-858-865-556-902;;065-870-977-280-737;;064-406-578-678-128;;108-753-104-645-026;;021-061-934-001-770;;090-569-071-311-350;;122-425-652-704-802;;107-991-640-620-989;;060-941-128-034-244;;168-716-459-078-087;;129-377-480-420-846;;034-394-102-210-702;;047-081-051-154-505;;119-897-038-546-75X,CA;;KR;;JP;;AT;;CN;;ES;;AU;;BR;;EA;;WO;;IL;;EP;;NO,22,105-192-163-541-239;;134-020-851-035-648;;180-924-000-952-106;;024-751-188-275-450;;016-383-533-535-529;;040-061-733-114-911;;083-707-604-623-680;;134-858-865-556-902;;065-870-977-280-737;;064-406-578-678-128;;108-753-104-645-026;;021-061-934-001-770;;090-569-071-311-350;;168-716-459-078-087;;122-425-652-704-802;;107-991-640-620-989;;060-941-128-034-244;;122-707-430-092-463;;129-377-480-420-846;;034-394-102-210-702;;047-081-051-154-505;;119-897-038-546-75X,CA;;KR;;JP;;AT;;CN;;ES;;NZ;;AU;;BR;;EA;;WO;;IL;;EP;;NO,0,A61K31/325;;A61P15/10;;A61P25/18;;A61P25/20;;A61P25/22;;A61P25/28;;A61P25/30;;A61P25/32;;A61P25/34;;A61P25/36;;A61P43/00;;A61K31/325,A61K31/325,,0,0,,,,ACTIVE
102,EP,B1,EP 1971600 B1,048-370-293-026-124,2013-08-21,2013,EP 06835537 A,2006-12-28,KR 2006005837 W;;KR 20050135247 A;;KR 20060135390 A,2005-12-30,ISOXAZOLE DERIVATIVES AND USE THEREOF,,SK BIOPHARMACEUTICALS CO LTD,CHO JEONG WOO;;CHOI SANG RAK;;HWANG SUN GWAN;;CHO KYUNG CHUL;;BAE SUNG JIN;;KOO TAE SUNG,"SK BIOPHARMACEUTICALS CO., LTD. (2012-02-22)",https://lens.org/048-370-293-026-124,Granted Patent,yes,4,0,11,086-802-411-620-47X;;105-300-638-607-197;;025-168-386-092-522;;048-370-293-026-124;;174-543-524-318-548;;180-028-851-411-441;;127-112-755-845-549;;078-127-951-586-595;;148-204-255-059-656;;141-256-840-629-613;;090-386-661-530-519,KR;;JP;;WO;;US;;ES;;EP,11,086-802-411-620-47X;;174-543-524-318-548;;105-300-638-607-197;;048-370-293-026-124;;025-168-386-092-522;;180-028-851-411-441;;127-112-755-845-549;;078-127-951-586-595;;148-204-255-059-656;;141-256-840-629-613;;090-386-661-530-519,KR;;JP;;WO;;US;;ES;;EP,0,C07D413/04;;A61P3/04;;A61P3/10;;A61P7/00;;A61P9/00;;A61P17/14;;A61P19/02;;A61P19/10;;A61P25/00;;A61P25/08;;A61P25/16;;A61P25/18;;A61P25/24;;A61P25/28;;A61P43/00;;C07D413/12;;C07D413/14;;C07D413/04;;C07D413/12;;C07D413/14;;C07D413/04;;C07D413/12;;C07D413/14,C07D413/14;;A61K31/42;;A61K31/4439,,2,0,,,"DUMAS J. ET AL.: 'Discovery of a new class of p38 kinase inhibitors' BIOORGANIC & MEDICINAL CHEMISTRY LETTERS vol. 10, 2000, pages 2047 - 2050, XP004208308;;PAE A. ET AL.: 'Synthesis and in vitro activity of new oxazolidinone antibacterial agents having substituted isoxazoles' BIOORGANIC & MEDICINAL CHEMISTRY vol. 9, no. 18, 1999, pages 2678 - 2684, XP003015387",ACTIVE
103,US,A1,US 2023/0338295 A1,162-629-133-790-943,2023-10-26,2023,US 202118019856 A,2021-08-06,KR 20200098589 A;;KR 2021010391 W,2020-08-06,"SOLID ORAL COMPOSITION COMPRISING CARBAMATE COMPOUND, AND PREPARATION METHOD THEREFOR","The present application relates to a solid oral preparation and a preparation method therefor, the preparation comprising granules, which comprise: as an active ingredient, a carbamate compound of chemical formula 1, or a pharmaceutically acceptable salt, an isomer, solvate or a hydrate thereof; a diluent; and a binder.",SK BIOPHARMACEUTICALS CO LTD,LEE JI HYE;;CHOI SO YOUNG;;KIM SANG JIN;;YANG YUN HEE,SK BIOPHARMACEUTICALS CO. LTD (2023-03-07),https://lens.org/162-629-133-790-943,Patent Application,yes,0,0,14,186-689-989-699-456;;099-013-292-546-341;;023-992-460-826-460;;168-363-351-489-684;;033-660-380-040-080;;137-403-608-831-721;;087-409-300-858-384;;162-629-133-790-943;;033-013-188-448-894;;081-824-751-235-813;;136-364-925-210-480;;141-583-179-569-985;;032-157-856-354-989;;097-063-225-075-669,CA;;KR;;JP;;CN;;CL;;AU;;BR;;WO;;MX;;US;;CO;;EP;;IL,14,186-689-989-699-456;;099-013-292-546-341;;023-992-460-826-460;;168-363-351-489-684;;033-660-380-040-080;;162-629-133-790-943;;087-409-300-858-384;;033-013-188-448-894;;137-403-608-831-721;;081-824-751-235-813;;136-364-925-210-480;;141-583-179-569-985;;032-157-856-354-989;;097-063-225-075-669,CA;;KR;;JP;;CN;;CL;;AU;;BR;;WO;;MX;;US;;CO;;EP;;IL,0,A61K31/41;;A61P25/00;;A61K9/2054;;A61K9/2018;;A61K9/2077;;A61K31/41;;A61P25/00;;A61K9/20;;A61K9/00;;A61K9/20;;A61K31/41;;A61P25/00;;A61K9/2027;;A61K9/2054;;A61K9/2077;;A61K9/2095;;A61K31/41,A61K9/20;;A61K31/41,,0,0,,,,PENDING
104,EP,A1,EP 4193987 A1,033-013-188-448-894,2023-06-14,2023,EP 21852199 A,2021-08-06,KR 20200098589 A;;KR 2021010391 W,2020-08-06,"SOLID ORAL COMPOSITION COMPRISING CARBAMATE COMPOUND, AND PREPARATION METHOD THEREFOR","The present application relates to a solid oral preparation and a preparation method therefor, the preparation comprising granules, which comprise: as an active ingredient, a carbamate compound of chemical formula 1, or a pharmaceutically acceptable salt, an isomer, solvate or a hydrate thereof; a diluent; and a binder.",SK BIOPHARMACEUTICALS CO LTD,LEE JI HYE;;CHOI SO YOUNG;;KIM SANG JIN;;YANG YUN HEE,,https://lens.org/033-013-188-448-894,Patent Application,yes,0,0,14,186-689-989-699-456;;099-013-292-546-341;;023-992-460-826-460;;168-363-351-489-684;;033-660-380-040-080;;137-403-608-831-721;;087-409-300-858-384;;162-629-133-790-943;;033-013-188-448-894;;081-824-751-235-813;;136-364-925-210-480;;141-583-179-569-985;;032-157-856-354-989;;097-063-225-075-669,CA;;KR;;JP;;CN;;CL;;AU;;BR;;WO;;MX;;US;;CO;;EP;;IL,14,186-689-989-699-456;;099-013-292-546-341;;023-992-460-826-460;;168-363-351-489-684;;033-660-380-040-080;;162-629-133-790-943;;087-409-300-858-384;;033-013-188-448-894;;137-403-608-831-721;;081-824-751-235-813;;136-364-925-210-480;;141-583-179-569-985;;032-157-856-354-989;;097-063-225-075-669,CA;;KR;;JP;;CN;;CL;;AU;;BR;;WO;;MX;;US;;CO;;EP;;IL,0,A61K31/41;;A61P25/00;;A61K9/2054;;A61K9/2018;;A61K9/2077;;A61K31/41;;A61P25/00;;A61K9/20;;A61K9/00;;A61K9/20;;A61K31/41;;A61P25/00;;A61K9/2027;;A61K9/2054;;A61K9/2077;;A61K9/2095;;A61K31/41,A61K9/00;;A61K9/20;;A61K31/41;;A61P25/00,,0,0,,,,PENDING
105,WO,A1,WO 2022/260484 A1,042-362-798-819-439,2022-12-15,2022,KR 2022008238 W,2022-06-10,US 202163209463 P,2021-06-11,METHODS FOR TREATING AUTISM SPECTRUM DISORDERS (ASD),"The present disclosure relates generally to methods of treating autism spectrum disorders (ASD), using a compound of Formula (I).",SK BIOPHARMACEUTICALS CO LTD,CHUNG JIN YONG;;CHO SEOK HWAN;;LEE HYUN SEOK;;KANG HO WON;;KWAK YONG DO;;JO MIN JAE,,https://lens.org/042-362-798-819-439,Patent Application,yes,4,0,6,134-609-150-463-748;;060-648-609-873-61X;;104-451-252-149-981;;174-192-293-170-66X;;010-584-163-358-424;;042-362-798-819-439,KR;;JP;;WO;;CN;;US;;EP,6,134-609-150-463-748;;060-648-609-873-61X;;174-192-293-170-66X;;104-451-252-149-981;;010-584-163-358-424;;042-362-798-819-439,KR;;JP;;WO;;US;;CN;;EP,0,A61P25/18;;A61K31/27;;A61K31/27;;A61P25/18;;A61P25/00;;A61K31/27,A61K31/27;;A61P25/18,,1,1,063-545-337-862-956,10.1002/ebch.804;;21874125;;pmc3160736,"REIERSEN ANGELA M., HANDEN BENJAMIN: ""Commentary on ‘Selective serotonin reuptake inhibitors (SSRIs) for autism spectrum disorders (ASD)’"", EVIDENCE-BASED CHILD HEALTH: A COCHRANE REVIEW JOURNAL, JOHN WILEY & SONS, GB, vol. 6, no. 4, 1 July 2011 (2011-07-01), GB , pages 1082 - 1085, XP093014263, ISSN: 1557-6272, DOI: 10.1002/ebch.786",PENDING
106,US,A1,US 2024/0261248 A1,174-192-293-170-66X,2024-08-08,2024,US 202218565188 A,2022-06-10,US 202218565188 A;;US 202163209463 P;;KR 2022008238 W,2021-06-11,METHODS FOR TREATING AUTISM SPECTRUM DISORDERS (ASD),"The present disclosure relates generally to methods of treating autism spectrum disorders (ASD), using a compound of Formula (I).",SK BIOPHARMACEUTICALS CO LTD,CHUNG JIN YONG;;CHO SEOK HWAN;;LEE HYUN SEOK;;KANG HO WON;;KWAK YONG DO;;JO MIN JAE,SK BIOPHARMACEUTICALS CO. LTD (2023-11-20),https://lens.org/174-192-293-170-66X,Patent Application,yes,0,0,6,134-609-150-463-748;;060-648-609-873-61X;;104-451-252-149-981;;174-192-293-170-66X;;010-584-163-358-424;;042-362-798-819-439,KR;;JP;;WO;;CN;;US;;EP,6,134-609-150-463-748;;060-648-609-873-61X;;174-192-293-170-66X;;104-451-252-149-981;;010-584-163-358-424;;042-362-798-819-439,KR;;JP;;WO;;US;;CN;;EP,0,A61P25/18;;A61K31/27;;A61K31/27;;A61P25/18;;A61P25/00;;A61K31/27,A61K31/27;;A61P25/00,,0,0,,,,PENDING
107,EP,B1,EP 2668185 B1,088-227-008-969-940,2016-11-23,2016,EP 12739548 A,2012-01-30,KR 20110008962 A;;KR 2012000652 W,2011-01-28,PHARMACEUTICAL COMPOSITION COMPRISING PYRIDONE DERIVATIVES,,SK BIOPHARMACEUTICALS CO LTD,MAENG CHEOL YOUNG;;JANG YOUNG KOO;;CHA SU BONG;;SHIN HYE WON;;JOUNG CHAN MI;;YI EUN JUNG,,https://lens.org/088-227-008-969-940,Granted Patent,yes,3,0,38,160-480-516-887-544;;183-766-785-119-795;;160-096-087-153-799;;099-303-326-630-265;;051-707-988-629-545;;149-102-626-714-234;;101-580-233-424-02X;;044-324-660-024-436;;102-040-318-042-150;;007-323-109-150-557;;137-515-039-683-971;;189-311-118-248-822;;062-832-256-786-926;;050-248-377-994-31X;;088-227-008-969-940;;157-104-881-167-142;;152-586-696-716-747;;035-204-582-504-764;;161-532-728-723-347;;036-183-174-524-762;;107-439-176-766-714;;180-020-553-513-144;;048-244-289-031-230;;055-337-448-583-566;;078-468-980-971-420;;118-444-082-208-16X;;186-169-532-756-87X;;010-744-547-429-455;;018-173-814-634-256;;118-637-540-893-40X;;062-326-391-883-33X;;002-242-574-877-309;;122-108-042-351-860;;175-203-797-197-070;;043-935-753-398-011;;161-082-200-130-505;;143-337-255-827-237;;111-560-504-700-722,CA;;RU;;KR;;JP;;ZA;;CN;;PL;;CL;;ES;;AU;;BR;;MX;;WO;;US;;HK;;EP,38,160-480-516-887-544;;183-766-785-119-795;;160-096-087-153-799;;099-303-326-630-265;;051-707-988-629-545;;149-102-626-714-234;;101-580-233-424-02X;;044-324-660-024-436;;102-040-318-042-150;;007-323-109-150-557;;137-515-039-683-971;;189-311-118-248-822;;062-832-256-786-926;;050-248-377-994-31X;;088-227-008-969-940;;157-104-881-167-142;;152-586-696-716-747;;035-204-582-504-764;;161-532-728-723-347;;036-183-174-524-762;;107-439-176-766-714;;180-020-553-513-144;;048-244-289-031-230;;055-337-448-583-566;;078-468-980-971-420;;118-444-082-208-16X;;186-169-532-756-87X;;010-744-547-429-455;;018-173-814-634-256;;118-637-540-893-40X;;062-326-391-883-33X;;002-242-574-877-309;;122-108-042-351-860;;175-203-797-197-070;;043-935-753-398-011;;161-082-200-130-505;;143-337-255-827-237;;111-560-504-700-722,CA;;RU;;KR;;JP;;ZA;;CN;;PL;;CL;;ES;;AU;;BR;;MX;;WO;;US;;HK;;EP,0,A61K31/439;;A61K31/497;;C07D453/02;;A61K31/4709;;A61K31/4725;;A61P25/00;;A61P25/18;;A61P25/28;;A61P43/00;;A61P25/28;;A61K9/0053;;A61K31/439;;C07D453/02;;A61K31/444;;A61K31/4748;;C07D471/08;;C07D453/02;;A61K31/439;;A61K31/497;;A61K9/0053;;A61K31/4709;;A61K31/4725,C07D471/08;;A61K31/4748;;A61P25/00;;C07D417/14,,1,0,,,"STEPHEN W. WRIGHT, ANTHONY A. CARLO, MAYNARD D. CAR ET AL.: ""Anilinoquinazoline inhibitors of fructose 1,6-bisphosphatase bind at a novel allosteric site: Synthesis, in vitro characterization, and X-ray crystallography"", J. MED. CHEM., vol. 45, 26 July 2002 (2002-07-26), pages 3865-3877, XP002719804,",ACTIVE
